{
  "$schema": "https://json-schema.org/draft/2020-12/schema",
  "$id": "https://schemas.ukma.dev/v1/memory.consolidate.request.schema.json",
  "title": "memory.consolidate Request [PHASE2 PROVISIONAL]",
  "type": "object",
  "additionalProperties": false,
  "required": [
    "api_version",
    "operation",
    "context",
    "input"
  ],
  "properties": {
    "api_version": {
      "const": "1"
    },
    "operation": {
      "const": "ukma.memory.consolidate.v1"
    },
    "context": {
      "$ref": "shared.schema.json#/$defs/RequestContext"
    },
    "input": {
      "type": "object",
      "properties": {
        "episode_refs": {
          "type": "array",
          "items": {
            "$comment": "ITEM TYPE REQUIRES MANUAL CLOSURE"
          }
        },
        "policy_id": {
          "type": "string",
          "minLength": 1
        },
        "async": {
          "const": true
        }
      },
      "required": [
        "episode_refs",
        "policy_id",
        "async"
      ],
      "additionalProperties": false
    }
  },
  "$comment": "NOT A CLOSED INPUT CONTRACT: inferred from normative markdown table; require exact IDL and invariants."
}
