{
  "api_version": "1",
  "operation": "ukma.memory.consolidate.v1",
  "context": {
    "request_id": "x",
    "trace_id": "x",
    "scope": {
      "tenant_id": "x",
      "project_id": "x"
    },
    "principal_id": "x",
    "scopes": [],
    "consistency": "eventual"
  },
  "input": {
    "episode_refs": [],
    "policy_id": "x",
    "async": true
  }
}
